{
  "schema_version": "provenance-manifest-v0",
  "run_id": "run:mock-001",
  "timestamp": "2026-08-16T00:00:00Z",
  "krypton_package_version": "1.0.0",
  "git_commit": "1111111111111111111111111111111111111111",
  "dirty_worktree": false,
  "edit_object": {
    "id": "edit:mock-snv",
    "version": "edit-object-v0",
    "digest": "2222222222222222222222222222222222222222222222222222222222222222"
  },
  "keg": {
    "id": "keg:mock-v0",
    "version": "keg-v0",
    "digest": "3333333333333333333333333333333333333333333333333333333333333333"
  },
  "mpt": {
    "id": "mapping:activity-clearance",
    "version": "1.0.0",
    "digest": "4444444444444444444444444444444444444444444444444444444444444444"
  },
  "model_artifact": {
    "id": "contract:mock-pk",
    "version": "1.0.0",
    "digest": "09b1bbefaef9b9a44abea8422d3c504b17e26f2b7436fb82340a12a905a63b5e"
  },
  "pair_run_spec": {
    "id": "pair:mock-clearance",
    "version": "pair-run-spec-v0",
    "digest": "6666666666666666666666666666666666666666666666666666666666666666"
  },
  "environment_digest": "7777777777777777777777777777777777777777777777777777777777777777",
  "dataset_versions": [],
  "container_image_digest": null,
  "python_version": "3.12.13",
  "dependency_lock_digest": "5555555555555555555555555555555555555555555555555555555555555555",
  "random_seed": 42
}
